timestamp,subject,description,failed_draft,review_feedback
2025-08-07T16:23:11.967759,Refund request not processed,I was promised a refund last week but haven't received it yet.,"Dear [User],

Thank you for reaching out about your refund request. I apologize that it has taken longer than expected to process, and I'm here to help resolve the issue.

I've reviewed our system, and I'd like to assure you that we're committed to providing a smooth experience for all our customers. To better assist you, could you please provide more details about your original refund request, such as the order number or the date you submitted the request? This information will help me look into the matter further.

Additionally, just to confirm, have you checked your account settings under the 'Billing' tab to ensure that your payment method is up-to-date and correct? If not, please feel free to update it if necessary.

As per our refund policy, we typically process refunds within 5-7 business days once approved. I understand that this may take a bit longer than expected in your case, but rest assured that I'm working to get this sorted out for you as soon as possible.

If there are any issues with your payment method or if your card has been declined, please verify with your bank or try another payment method to ensure a smooth processing of the refund.

Please know that our billing cycles begin on the day of your first successful payment, and we only issue refunds with manager approval. I'm happy to escalate this matter to my manager if necessary to ensure you receive the refund you're expecting.

Thank you for your patience, and please let me know if there's anything else I can do to assist you.",Needs improvement
2025-08-07T18:05:16.628684,Refund request not processed,I was promised a refund last week but haven't received it yet.,"Dear [Customer],

Thank you for reaching out to us about your refund request not being processed. I apologize for any inconvenience this has caused, and I'm happy to help resolve the issue.

I understand that you were promised a refund last week, but unfortunately, it's taking longer than expected to process. Refunds typically take 5-7 business days to be processed once approved, so I want to check on the status of your request.

To better assist you, can you please confirm the following:

1. Have you checked your account settings under the 'Billing' tab to ensure that your payment method is up-to-date?
2. Has anyone from our team or a manager reviewed and approved your refund request?

If we haven't received any updates on your refund request, I'll be happy to escalate it for further review. Please know that refunds are not automatically issued without manager approval.

In the meantime, if you have any questions or concerns about your account or payment method, please don't hesitate to reach out. We're here to help and want to ensure a smooth resolution for you.

Thank you again for bringing this to our attention, and I look forward to resolving this issue for you soon!

Best regards,
[Your Name]
Support Agent",Needs improvement
2025-08-07T18:08:45.172709,Refund request not processed,I was promised a refund last week but haven't received it yet.,"Dear [Customer],

Thank you for reaching out to us about the status of your refund request. I apologize that it hasn't been processed yet, and I'm here to help resolve this issue for you.

Firstly, please know that we take all requests seriously and are committed to providing a fair and timely resolution. To better assist you, can you please confirm that you have submitted a refund request and provided the necessary information?

Regarding your refund request, I'd like to clarify that our refunds team typically takes 5-7 business days to process approved requests after receipt of all required information. If there's any additional information needed from your end, we'll let you know as soon as possible.

In some cases, card declines can cause delays in processing refunds. If this is the case for you, please verify with your bank or try another payment method to ensure a smooth transaction.

Additionally, our billing cycles begin on the day of your first successful payment, and refunds are only issued after approval from our manager. This ensures that all requests are thoroughly reviewed before being processed.

I understand that you were promised a refund last week, and I'll make sure to escalate this matter to our refunds team for further investigation. We'll work together to resolve this issue as soon as possible.

In the meantime, please feel free to update your payment method in your account settings under the 'Billing' tab if you'd like to try an alternative payment option. This may help facilitate a faster refund processing time.

Please allow me some time to investigate and follow up with our refunds team. I'll be in touch soon to provide an update on the status of your request. If you have any further questions or concerns, please don't hesitate to reach out.

Thank you for your patience and understanding. We appreciate your business and look forward to resolving this matter for you.

Best regards,
[Your Name]
Support Agent",Include specific refund timeframe and clarify approval policy.
2025-08-07T18:23:38.843481,Refund request not processed,I was promised a refund last week but haven't received it yet.,"Thank you for reaching out to us about your refund request. I'm sorry to hear that you haven't received your refund yet, despite being promised one last week.

I'd like to assure you that we take all refund requests seriously and are committed to resolving this issue as quickly as possible. To better assist you, can you please provide me with more details about your original refund request? This includes the date you were promised a refund and any relevant order or transaction numbers.

In the meantime, I want to check on the status of your refund request. As per our standard process, refunds typically take 5-7 business days to process once approved. If there's an issue with processing your refund, we'll need to investigate further and obtain manager approval before moving forward.

Before we proceed, please note that you can update your payment method in your account settings under the 'Billing' tab if you're concerned about any potential issues with your current card or payment method. Additionally, if your card is declined, please verify with your bank or try another payment method to ensure a smooth transaction.

I'll do my best to get to the bottom of this and have your refund processed as soon as possible. I appreciate your patience and understanding in this matter. If you have any further questions or concerns, please don't hesitate to reach out.

Thank you for choosing our service, and I look forward to updating you on the status of your refund request soon!",Forced rejection for test mode.
